{
  "diligence_run": {
    "run_id": "step5-quality-audit-2026-06-06T23-17-34-239Z",
    "submitted_at": "2026-06-06T23:17:34.242Z",
    "source_mode": "url",
    "compiler_status": "completed"
  },
  "source_bundle_summary": {
    "summary": "The source bundle contains the homepage of Sarvam.ai. The content provides high-level information regarding their AI platform, enterprise deployment options, and security/governance claims. No specific legal documents (e.g., full ToS, Privacy Policy, DPA) were retrieved.",
    "pages_attempted": 1,
    "pages_admitted": 1,
    "limitations": [
      "Only the homepage was retrieved; no dedicated legal or governance pages were captured.",
      "Security and compliance claims (SOC 2, ISO 27001, DPDP) are mentioned on the homepage but no supporting certificates or full policy documents were provided."
    ]
  },
  "target_profile": {
    "company_name": "Sarvam AI",
    "website": "https://sarvam.ai/",
    "legal_entity": "not visible in admitted evidence",
    "hq_jurisdiction": "not visible in admitted evidence",
    "actual_processing_location": "not visible in admitted evidence",
    "data_sovereignty_signature": "Data residency controls mentioned; specific hosting regions not visible.",
    "primary_claim": "Enterprise-grade AI platform with compliance, control, and deployment flexibility."
  },
  "primary_product": {
    "product_name": "Arya",
    "user": "enterprise organizations",
    "function": "AI platform deployment",
    "mechanism": "deploys AI models into private cloud, on-premise, hybrid, or air-gapped environments",
    "agent_actor": "not visible in admitted evidence",
    "agent_brand_name": "not visible in admitted evidence"
  },
  "product_feature_map": [
    {
      "feature_id": "F001",
      "feature_name": "Enterprise AI Deployment",
      "feature_role": "CORE",
      "feature_description": "The platform deploys AI models into customer-controlled environments including private cloud, on-premise, hybrid, or fully air-gapped setups.",
      "archetype_codes": [
        "UNI"
      ],
      "archetype_labels": [
        "Universal"
      ],
      "surface_tokens": [
        "Enterprise-Private",
        "Infrastructure"
      ],
      "evidence_quote": "Arya deploys where your data already lives. Private cloud, on-premise, hybrid, or fully air-gapped environments.",
      "feature_source_url": "https://sarvam.ai/",
      "linked_threat_ids": [
        "SMOKE-003"
      ]
    },
    {
      "feature_id": "F002",
      "feature_name": "Governance and Compliance Controls",
      "feature_role": "SECONDARY",
      "feature_description": "Provides security and compliance features including role-based access control, audit trails, and data residency management.",
      "archetype_codes": [
        "UNI"
      ],
      "archetype_labels": [
        "Universal"
      ],
      "surface_tokens": [
        "Enterprise-Private"
      ],
      "evidence_quote": "Role-based access Full audit trail Data residency controls",
      "feature_source_url": "https://sarvam.ai/",
      "linked_threat_ids": [
        "SMOKE-002"
      ]
    }
  ],
  "legal_stack": [
    {
      "document_type": "ToS",
      "exists": false,
      "document_url": "N/A",
      "covers": null,
      "misses": [],
      "evidence_status": "ABSENT",
      "linked_threat_ids": [
        "SMOKE-003"
      ]
    },
    {
      "document_type": "Privacy Policy",
      "exists": false,
      "document_url": "N/A",
      "covers": null,
      "misses": [],
      "evidence_status": "ABSENT",
      "linked_threat_ids": [
        "SMOKE-002"
      ]
    },
    {
      "document_type": "DPA",
      "exists": false,
      "document_url": "N/A",
      "covers": null,
      "misses": [],
      "evidence_status": "ABSENT",
      "linked_threat_ids": [
        "SMOKE-002"
      ]
    },
    {
      "document_type": "AUP",
      "exists": false,
      "document_url": "N/A",
      "covers": null,
      "misses": [],
      "evidence_status": "ABSENT",
      "linked_threat_ids": [
        "SMOKE-003"
      ]
    },
    {
      "document_type": "SLA",
      "exists": false,
      "document_url": "N/A",
      "covers": null,
      "misses": [],
      "evidence_status": "ABSENT",
      "linked_threat_ids": [
        "SMOKE-003"
      ]
    }
  ],
  "document_stack_redline": [
    {
      "mismatch_id": "M001",
      "type": "CLAIM_VS_ABSENCE",
      "quote": "SOC 2 Type II ISO 27001 DPDP compliant",
      "source": "https://sarvam.ai/",
      "feature_ref": "F002",
      "claim_type": "Compliance and Governance",
      "contradicts": "The homepage makes specific compliance claims (SOC 2, ISO 27001, DPDP), but no public legal or governance documents (ToS, Privacy Policy, DPA) are visible in the admitted evidence to support these claims."
    }
  ],
  "threat_registry_summary": {
    "registry_count_loaded": 3,
    "registry_count_evaluated": 3,
    "status_counts": {
      "TRIGGERED": 2,
      "CONTROLLED": 0,
      "NOT_TRIGGERED": 0,
      "NOT_APPLICABLE": 1,
      "INSUFFICIENT_EVIDENCE": 0
    },
    "counts_by_pain_tier": {
      "UNKNOWN": 3
    },
    "counts_by_pain_category": {
      "UNKNOWN": 3
    },
    "counts_by_archetype": {
      "UNKNOWN": 3
    },
    "counts_by_surface": {
      "UNKNOWN": 3
    },
    "counts_by_lane": {
      "UNKNOWN": 3
    },
    "operator_challenge_result": "PASS",
    "reopened_count": 0,
    "warnings": [
      "Registry payload missing for threat SMOKE-002",
      "Registry payload missing for threat SMOKE-003"
    ]
  },
  "feature_to_threat_matrix": [
    {
      "feature_ref": "F001",
      "feature_name": "Enterprise AI Deployment",
      "archetype_codes": [
        "UNI"
      ],
      "surface_tokens": [
        "Enterprise-Private",
        "Infrastructure"
      ],
      "triggered_threat_ids": [
        "SMOKE-003"
      ],
      "controlled_threat_ids": [],
      "insufficient_evidence_threat_ids": [],
      "not_triggered_threat_ids": [],
      "not_applicable_threat_ids": [],
      "document_routes": [
        "DOC_TOS",
        "DOC_AUP",
        "DOC_SLA"
      ],
      "summary": "Deployment infrastructure lacks visible service terms."
    },
    {
      "feature_ref": "F002",
      "feature_name": "Governance and Compliance Controls",
      "archetype_codes": [
        "UNI"
      ],
      "surface_tokens": [
        "Enterprise-Private"
      ],
      "triggered_threat_ids": [
        "SMOKE-002"
      ],
      "controlled_threat_ids": [],
      "insufficient_evidence_threat_ids": [],
      "not_triggered_threat_ids": [],
      "not_applicable_threat_ids": [],
      "document_routes": [
        "DOC_PP",
        "DOC_DPA"
      ],
      "summary": "Compliance claims lack visible governance documentation."
    },
    {
      "feature_ref": "GLOBAL",
      "feature_name": "GLOBAL",
      "archetype_codes": [],
      "surface_tokens": [],
      "triggered_threat_ids": [],
      "controlled_threat_ids": [],
      "insufficient_evidence_threat_ids": [],
      "not_triggered_threat_ids": [],
      "not_applicable_threat_ids": [
        "SMOKE-001"
      ],
      "document_routes": [],
      "summary": "Feature matrix row for GLOBAL."
    }
  ],
  "findings": [
    {
      "finding_id": "FIND-001",
      "threat_id": "SMOKE-002",
      "threat_name": "Missing public AI/data processing posture",
      "status": "TRIGGERED",
      "pain_tier": "UNKNOWN",
      "pain_category": "UNKNOWN",
      "pain_depth": "UNKNOWN",
      "lane": "UNKNOWN",
      "archetype": "UNI",
      "surface_tokens": [],
      "subcat": "UNKNOWN",
      "authority": {
        "IN": "UNKNOWN",
        "EU": "UNKNOWN",
        "US": "UNKNOWN"
      },
      "linked_feature_ids": [
        "F002"
      ],
      "evidence": {
        "source_url": "https://sarvam.ai/",
        "artifact_class": "security",
        "proof_citation": "legal_stack:Privacy Policy:ABSENT",
        "evidence_mode": "ABSENCE",
        "source_hash": "simple-3641a2cc",
        "extracted_excerpt": "Privacy Policy and DPA marked ABSENT in admitted legal_stack_review."
      },
      "trigger_evaluation": {
        "conditions_passed": [
          "CONDITION_1",
          "CONDITION_2"
        ],
        "conditions_failed": [],
        "trigger_if_result": true,
        "exclude_if_result": false,
        "exclude_if_basis": ""
      },
      "registry_payload": {
        "legal_pain": "",
        "fp_mechanism": "",
        "fp_impact": "",
        "lex_nova_fix": ""
      },
      "redline_route": [],
      "document_routes": [
        "DOC_PP",
        "DOC_DPA"
      ],
      "vault_dependencies": [
        "compliance.processes_pii"
      ],
      "finding_memo_note": "Governance gap: Compliance claims made without visible public privacy or data processing documentation."
    },
    {
      "finding_id": "FIND-002",
      "threat_id": "SMOKE-003",
      "threat_name": "API/service terms coverage gap",
      "status": "TRIGGERED",
      "pain_tier": "UNKNOWN",
      "pain_category": "UNKNOWN",
      "pain_depth": "UNKNOWN",
      "lane": "UNKNOWN",
      "archetype": "UNI",
      "surface_tokens": [],
      "subcat": "UNKNOWN",
      "authority": {
        "IN": "UNKNOWN",
        "EU": "UNKNOWN",
        "US": "UNKNOWN"
      },
      "linked_feature_ids": [
        "F001"
      ],
      "evidence": {
        "source_url": "https://sarvam.ai/",
        "artifact_class": "other",
        "proof_citation": "legal_stack:ToS:ABSENT",
        "evidence_mode": "ABSENCE",
        "source_hash": "simple-3641a2cc",
        "extracted_excerpt": "ToS, AUP, and SLA marked ABSENT in admitted legal_stack_review."
      },
      "trigger_evaluation": {
        "conditions_passed": [
          "CONDITION_1",
          "CONDITION_2"
        ],
        "conditions_failed": [],
        "trigger_if_result": true,
        "exclude_if_result": false,
        "exclude_if_basis": ""
      },
      "registry_payload": {